{
  "session_id": "2026-06-19-diamat-ciclo-vital",
  "title": "diamat, ciclo vital, ¿hay ciencia universal sin envejecer?",
  "semilla": "diamat, ciclo vital, ¿hay ciencia universal sin envejecer?",
  "loadout_id": "default-tablero",
  "profile_slug": "composer",
  "profile_ref": "data/profiles/composer.json",
  "posicion_linea": 0.42,
  "status": "published",
  "created_at": "2026-06-19T09:59:53Z",
  "committed_at": "2026-06-19T09:59:53Z",
  "asentamiento_path": "asentamiento.md",
  "respuesta_path": "respuesta.md",
  "engines_active": {
    "main_engine": "on",
    "forces": [
      "engine-model-A",
      "engine-model-E"
    ]
  },
  "url_prensa": "prensa/sesiones/2026-06-19-diamat-ciclo-vital.html"
}
